{
  "running": true,
  "apiReachable": true,
  "endpoint": {
    "owner": "a2",
    "controller": "127.0.0.1:9097",
    "managed": true,
    "configPath": "/Users/alice/.a2/mihomo/config.yaml"
  },
  "version": "v1.19.28",
  "mode": "rule",
  "mixedPort": 7897,
  "node": "香港 01",
  "systemProxy": {
    "supported": true,
    "takenOver": true,
    "host": "127.0.0.1",
    "port": 7897
  }
}
